{
  "review_id": "local-2fb0b32c",
  "source": "mobile_app_screenshot",
  "user_id_hash": null,
  "raw_text": "I love the new update! The app feels smoother and the checkout is much faster now. Great job team! ðŸ˜Š\n",
  "extracted_text": "I love the new update! The app feels smoother and the checkout is much faster now. Great job team! ðŸ˜Š\n",
  "analysis": {
    "sentiment": "positive",
    "score": 0.9,
    "themes": [
      "checkout",
      "praise"
    ],
    "intent": "praise",
    "action_items": [
      "Investigate checkout flow and payment logs"
    ],
    "confidence": 0.96
  },
  "image_gcs_path": null,
  "language": "en",
  "model": "mock",
  "processing_latency_ms": 0,
  "created_at": "2025-11-20T09:02:40.603861+00:00",
  "processed_at": "2025-11-20T09:02:40.603861+00:00",
  "metadata": {
    "upload_method": "local_ui"
  }
}